{
  "schema_version": 1,
  "fixture_id": "electron-degraded",
  "state": "degraded",
  "provider": "none",
  "network": "disabled",
  "fictional": true,
  "content": {
    "title": "Diagnostics",
    "status": "Degraded",
    "prompt": "",
    "response": "",
    "detail": "The desktop service did not start."
  },
  "privacy_canaries": []
}
